"","ResponseId","desc_inapp"
"380","R_3HCbSkj29cQpsmP","If you are holding a grudge simply of jealousy, it may be worthwhile to rethink whether it's appropriate to do so or not."
"381","R_8kvHiJlty52pRAJ","when you have been hurt and it was an accident, an unintentional event. bascially the opposite of the situation described earlier where a grudge was justified"
"382","R_2TRVKxlSNNISOkk","I think it's wrong to hold one for very long. It just upsets you and is bad for your mental health."
"383","R_3qvwUMlBuQbub6t","Over small things that maybe the other person didn't know they were doing or had no control over."
"384","R_3nJHWBr3ITzf9Pn","I think it would be wrong to hold a grudge if someone did something little to bother someone else when they had no idea that what they were doing was disliked by the other person."
"385","R_UtZ7z2sL6Tv2XqV","It is wrong to hold a grudge when you lose something that is not important like a toy or food"
"386","R_wS6axwprAU0v3R7","If someone made a truly genuine mistake like they sent your package to the wrong house and you never got it."
"387","R_9FiFnum2NEHeWxb","If your friend didn't invite you to a ski trip because she knew you didn't like to ski."
"388","R_3M9ksfMZ1BcAflS","I think when someone does something that they are truly sorry for that doesn't include murder then it is fair to not hold a grudge. It's also healthy. You shouldn't hold a grudge when someone is truly sorry and has repented."
"389","R_3DhIXvK2EPWIPvy","If someone does something for you hoping that it will help, but it ends up harming you. If they sincerely apologize, and their intentions are genuine, there's no reason to hold a grudge."
"390","R_3sdLMDP1jJvDy90","When the grudge doesn't have long-lasting repercussions, or the reason for the grudge was so long ago it was forgotten, or if it could be resolved by having a mature discussion, or if recompense was made and agreed upon by both parties"
"391","R_2zpFuKl81nPaNOn","It is wrong to hold a grudge when someone almost hits you while driving"
"392","R_1CkgIeMqN6Yycps","If something was done accidentally, I don't think a grudge is warranted. I think intent is something that people need to take into account in these situations. I think if someone hurt someone's feelings but didn't mean it and this isn't a regular occurrence, then it should be forgiven."
"393","R_1JXcwHgKbUMuUVJ","I think it is wrong to hold a grudge against someone when they have mistakenly hurt you, have significantly changed and apologized since hurting you, or there were other factors that played into the reason/cause of them hurting you. An apology is very important in all of these scenarios."
"394","R_24IsVOiHHnBJoYE","If a friend messes up in a genuinely accidental way"
"395","R_2uJuycCy6b3hGDr","When you have minor issues that can be easily resolved"
"396","R_qQ8Uje07zhwkPlf","someone hitting a trigger,but its an innocent remark"
"397","R_RWdzBXj1mXFy9Wx","It is wrong to hold a grudge period."
"398","R_2pQRaZc5kIusRsU","When someone received something that you wanted, such as a promotion."
"399","R_1la7y7vn8gGWnMt","In a situation where a person accidentally harmed you and has asked forgiveness and made restitution."
"400","R_274lmZB2oivlCbL","If it was an accident."
"401","R_XGkFhrwNzsaM6Ln","when someone makes a joke, sometimes it is only a joke, a some peole get mad about that"
"402","R_2CVtl6K9beFHhN2","When the other person is genuinely sorry and feels bad for what happened, or when it was an accident"
"403","R_2zISVNbyggtfpFy","started issue"
"404","R_1KjPR8FOPPQJCI9","Always"
"405","R_3ma8PSOsz306763","All reasons."
